{
  "version": "1.0",
  "meta": {
    "title": "图表页 · 三种真画",
    "subtitle": "折线看顶点 / 占比环看扇区角 / 柱状看柱高 —— 三种都做像素级反推",
    "issuer": "AiMarketing 视频工厂",
    "date": "2026-10",
    "lang": "zh-CN"
  },
  "style": {
    "masterId": "master-v2",
    "palette": "azure",
    "density": "normal",
    "tempo": "normal",
    "orientation": "9:16"
  },
  "pages": [
    {
      "type": "cover",
      "kicker": "CHART TYPES · PIXEL VERIFIED",
      "asset": "assets/cover.jpg"
    },
    {
      "type": "chart",
      "title": "单帧耗时走势",
      "chart": {
        "type": "line",
        "series": [
          62.5,
          70.5,
          92.3,
          29,
          24.9
        ],
        "labels": [
          "720p",
          "720p截图",
          "1080p",
          "母版12s",
          "六页18s"
        ]
      },
      "unit": "ms / 帧",
      "explain": "折线用来看走势与拐点：顶点 y 编码数值",
      "source": "本机 i7-12700F · 实测"
    },
    {
      "type": "chart",
      "title": "耗时占比构成",
      "chart": {
        "type": "donut",
        "series": [
          62.5,
          70.5,
          92.3,
          29,
          24.9
        ],
        "labels": [
          "720p",
          "720p截图",
          "1080p",
          "母版12s",
          "六页18s"
        ]
      },
      "unit": "占比",
      "explain": "占比环用来看构成：扇区角编码数值",
      "source": "本机 i7-12700F · 实测"
    },
    {
      "type": "chart",
      "title": "单帧耗时对照",
      "chart": {
        "type": "bar",
        "series": [
          62.5,
          70.5,
          92.3,
          29,
          24.9
        ],
        "labels": [
          "720p",
          "720p截图",
          "1080p",
          "母版12s",
          "六页18s"
        ]
      },
      "unit": "ms / 帧",
      "explain": "柱状用来比大小：柱高编码数值",
      "source": "本机 i7-12700F · 实测"
    },
    {
      "type": "end",
      "line1": "三种图表都能像素级验数",
      "line2": "折线看顶点、占比看扇角、柱状看柱高",
      "cta": "下一步：把图表数据接进分镜",
      "en": "LINE · DONUT · BAR · PIXEL-VERIFIED"
    }
  ]
}
