{
  "version": "1.0",
  "meta": {
    "title": "图片页三种版式",
    "subtitle": "left / right / full —— 三种都要证明素材真上屏",
    "lang": "zh-CN"
  },
  "style": {
    "masterId": "master-v1",
    "palette": "warm-gold",
    "density": "normal",
    "tempo": "normal",
    "orientation": "16:9"
  },
  "pages": [
    { "type": "cover", "kicker": "IMAGE LAYOUTS" },
    {
      "type": "image",
      "title": "左图右文版式",
      "asset": "assets/test-media.png",
      "layout": "left",
      "caption": "面板出血到左边缘，文案在右侧版心内"
    },
    {
      "type": "image",
      "title": "右图左文版式",
      "asset": "assets/test-media.png",
      "layout": "right",
      "caption": "面板出血到右边缘，文案在左侧版心内"
    },
    {
      "type": "image",
      "title": "满幅压字版式",
      "asset": "assets/test-media.png",
      "layout": "full",
      "caption": "文字压在图上，靠渐隐底衬保证对比度"
    },
    {
      "type": "end",
      "line1": "三种图片版式都已上屏",
      "line2": "素材像素与全幅对比度都有证据",
      "cta": "下一步：接入真实素材池",
      "en": "LEFT · RIGHT · FULL"
    }
  ]
}
